{
  "reached_level": 1,
  "candidate_level": 2,
  "uninterrupted_from_zero": true,
  "level_detected_by_measurement": true,
  "detected": {
    "difference": true,
    "localization": false
  },
  "measured_by": {
    "mean_amplitude_growth": 654.7208,
    "structure_factor_prominence": 16.692,
    "defect_count": 26,
    "persistent_defects": false
  },
  "purity": {
    "per_object_labels": false,
    "external_optimum": false,
    "role": "E"
  },
  "natural_emergence": {
    "started_from_time_zero": true,
    "target_shape_seeded": false,
    "runtime_interventions": 0,
    "target_dependent_rules": false,
    "target_dependent_stopping": false,
    "target_dependent_clipping": false,
    "level_detected_by_measurement": true
  }
}